_id,title,good_text,bad_text,normal_text,star,time,convert_time
6377b833f9045f01eb30b000,整體表現都很棒！如果樓梯或電梯可做個小整修可能會更棒！”,,,地理位置跟房間都蠻不錯！房間不會有異味很乾淨，下次到附近可再入住！,8.0,2015年10月23日星期五,2015/10/23
6377b833f9045f01eb30b001,超小.浴室的水會流到床鋪.房間有很濃得裝潢刺鼻味”,,,-,4.7,2015年10月23日星期五,2015/10/23
6377b833f9045f01eb30b002,浴室水壓不強，房型坪數稍顯少，冷氣不涼”,,,早餐菜色不錯,6.0,2015年10月19日星期一,2015/10/19
6377b833f9045f01eb30b003,覺得非常溫馨！”,,,1）由於我們原先訂的雙人套房房型正在保養（到現場才知道）所以他們免費幫我們升級到豪華房，打開裡面非常乾淨舒服，除了床旁邊（靠近窗戶）可能有漏水和潮濕的問題，我男友把他的筆電放在地板上後出去到晚上，外面的保護套是微濕的XD但是大體上還是非常滿意歐！（門卡感應也很安全）,9.0,2015年10月14日星期三,2015/10/14
6377b833f9045f01eb30b004,不供給我所訂的房類給了細小的一間微型二人房不是我預定房的型號”,,,-,6.7,2015年10月13日星期二,2015/10/13
6377b833f9045f01eb30b005,出差住住還OK”,,,"方便, 附近吃的多, 隔音還行",7.7,2015年10月2日星期五,2015/10/2
6377b833f9045f01eb30b006,中等酒店”,,,1.位置好 2.設備不錯 3.房間略小,7.7,2015年9月30日星期三,2015/9/30
6377b833f9045f01eb30b007,如果你什麼都不挑惕 那就住這裡吧”,,,地點 地點 地點 地點 地點,5.3,2015年9月22日星期二,2015/9/22
6377b834f9045f01eb30b008,很好”,,,服務,10.0,2015年9月21日星期一,2015/9/21
6377b834f9045f01eb30b009,"很棒,一定會推薦給朋友,有機會到台北,一定會再來”",,,房間乾淨舒服、近101及松山煙廠、東區逛街吃飯超級方便,10.0,2015年9月20日星期日,2015/9/20
6377b834f9045f01eb30b00a,交通相當便利房內整潔”,,,交通相當便利 房間整潔 空間小而舒適,7.7,2015年9月20日星期日,2015/9/20
6377b834f9045f01eb30b00b,高服務品質”,,,1. 服務員服務真的超好超熱情,10.0,2015年9月19日星期六,2015/9/19
6377b834f9045f01eb30b00c,位居精華區，CP值高，小資住宿首選。”,,,床和枕頭很好睡，服務人員整理得很乾淨。離捷運站出口很近，往各景點的各式交通也非常便捷。飯店附近吃喝玩樂設施選擇多樣，適合各階層人士住宿。,10.0,2015年9月15日星期二,2015/9/15
6377b834f9045f01eb30b00d,麻雀雖小五臟俱全，個人住宿或情侶出遊相當適合。”,,,交通便利、基本生活機能充足。,7.0,2015年9月14日星期一,2015/9/14
6377b834f9045f01eb30b00e,性價比相當高，服務相當好”,,,性價比相當高，服務相當好，有免費幫我升等,8.7,2015年9月14日星期一,2015/9/14
6377b834f9045f01eb30b00f,地點方便，節省許多交通時間和費用。”,,,1.雖然在大馬路上，但是隔音蠻好的，聽不到馬路上的車聲。2.鄰近百貨公司、夜市、101，甚麼好玩的好吃的都在附近，超厲害的。3.地點十分方便，出捷運站沒多久就有許多商店可以逛，附近許多餐廳用餐很方便。,10.0,2015年9月14日星期一,2015/9/14
6377b834f9045f01eb30b010,3星的規模，5星的服務”,,,服務好、地點很方便、好逛,10.0,2015年9月10日星期四,2015/9/10
6377b834f9045f01eb30b011,雖然像是大樓公寓，不過我住的兩人房還不錯，乾淨，有人說會太吵，我覺得OK.”,,,乾淨，又有簡單的自助早餐，服務人員也還算親切，CP值高。,7.7,2015年9月8日星期二,2015/9/8
6377b834f9045f01eb30b012,不錯”,,,位置很好價錢ok房間蠻乾淨整潔,8.0,2015年8月30日星期日,2015/8/30
6377b834f9045f01eb30b013,房間很乾淨”,,,地點交通吃飯逛逛超方便,9.0,2015年8月21日星期五,2015/8/21
6377b834f9045f01eb30b014,交通方便，房間整齊清潔。”,,,交通，飲食，客房清潔,7.3,2015年8月20日星期四,2015/8/20
6377b834f9045f01eb30b015,房間潮濕 壁貼浮起”,,,地點佳,5.3,2015年8月20日星期四,2015/8/20
6377b834f9045f01eb30b016,方便”,,,離捷運近,8.0,2015年8月13日星期四,2015/8/13
6377b834f9045f01eb30b017,中等以上水準”,,,客房乾淨，門禁措施良好,8.3,2015年7月27日星期一,2015/7/27
6377b834f9045f01eb30b018,交通便利”,,,交通便利,6.3,2015年6月27日星期六,2015/6/27
6377b834f9045f01eb30b019,商務旅行的好選擇”,,,"交通方便,浴室乾淨整潔,鄰近商圈",7.7,2015年6月18日星期四,2015/6/18
6377b834f9045f01eb30b01a,地點很房，房間有點舊，晚上櫃台態度很流氓”,,,地點好，早上櫃台有禮貌，房間蠻大,5.7,2015年5月30日星期六,2015/5/30
6377b834f9045f01eb30b01b,除了地點好以外，沒有其他優點”,,,地點方便,4.3,2015年5月25日星期一,2015/5/25
6377b834f9045f01eb30b01c,位於東區，美食交通逛街都便利”,,,晚班服務人員親切有禮，整潔乾淨，交通便利,8.3,2015年5月6日星期三,2015/5/6
6377b834f9045f01eb30b01d,讚～會再來”,,,地點佳，乾淨,9.7,2015年4月25日星期六,2015/4/25
6377b834f9045f01eb30b01e,評價”,,,櫃檯服務，地點,6.3,2015年3月30日星期一,2015/3/30
6377b834f9045f01eb30b01f,圖文不符 房間超小”,,,裝潢好而已,4.3,2015年3月29日星期日,2015/3/29
6377b834f9045f01eb30b020,客房服務聚粵軒餐點好吃、乾淨整潔、位置佳”,,,客房服務聚粵軒餐點好吃、乾淨整潔、位置佳,7.7,2015年3月23日星期一,2015/3/23
6377b834f9045f01eb30b021,整潔可再加強”,,,地點超優,6.7,2015年3月11日星期三,2015/3/11
6377b834f9045f01eb30b022,不怎麼誠實的飯店”,,,交通便利,6.3,2015年2月6日星期五,2015/2/6
6377b834f9045f01eb30b023,舒適”,,,交通，購物，旅遊都很方便,8.0,2015年1月29日星期四,2015/1/29
6377b834f9045f01eb30b024,簡單乾淨”,,,廁所乾淨,7.3,2015年1月18日星期日,2015/1/18
6377b834f9045f01eb30b025,交通便利”,,,交通方便，購物方便，飲食方便,4.7,2014年12月22日星期一,2014/12/22
6377b834f9045f01eb30b026,地點不錯，但是客房wifi很弱，希望能改善。”,,,地點非常好，近捷運忠孝敦化及國父紀念館站，附近吃飯購物交通非常便利。,4.7,2014年12月22日星期一,2014/12/22
6377b835f9045f01eb30b027,照片與實際房間完全不符！”,,,完全沒有。,2.7,2014年11月15日星期六,2014/11/15
6377b835f9045f01eb30b028,很方便的地點”,,,交通方便&生活機能優,8.0,2014年11月13日星期四,2014/11/13
6377b835f9045f01eb30b029,除了交通方便，其他都很普通”,,,交通方便,5.7,2014年10月4日星期六,2014/10/4
6377b835f9045f01eb30b02a,地點便利，早餐普通。”,,,交通方便，逛街吃東西不成問題。,7.0,2014年8月28日星期四,2014/8/28
6377b835f9045f01eb30b02b,沒有好的景點”,,,地點好，還算乾淨，態度可。,5.3,2014年6月26日星期四,2014/6/26
6377b835f9045f01eb30b02c,還不賴 ”,,,離東區很近,8.0,2014年6月14日星期六,2014/6/14
6377b835f9045f01eb30b02d,不錯 只是晚上附近有點亂”,,,捷運 方便,7.3,2014年5月9日星期五,2014/5/9
6377b835f9045f01eb30b02e,交通方便，房間舒適”,,,交通方便，房間舒適,8.7,2014年4月7日星期一,2014/4/7
6377b835f9045f01eb30b02f,熱鬧 交通便利 ”,,,乾淨 交通方便 好找,7.0,2014年3月18日星期二,2014/3/18
6377b835f9045f01eb30b030,交通方便的小型旅館”,,,房間乾淨、服務人員親切、交通便利,7.7,2014年2月16日星期日,2014/2/16
6377b835f9045f01eb30b031,房間很小。”,,,地點,5.3,2013年12月27日星期五,2013/12/27
6377b835f9045f01eb30b032,交通方便，附近很好逛街”,,,交通方便，附近很熱鬧。,7.7,2013年12月20日星期五,2013/12/20
6377b835f9045f01eb30b033,非常好的住宿體驗，房間寬敞又乾淨。”,,,對於商務旅客方便，優惠時段如果可以提前至八點入住會更好。對於商務旅客，一定要確認是否可以用電子收據報帳。,9.3,2013年12月20日星期五,2013/12/20
6377b835f9045f01eb30b034,地點便利”,,,地點近捷運，週邊也有很多公車可以搭乘，購物方便。,7.0,2013年11月28日星期四,2013/11/28
6377b835f9045f01eb30b035,"近捷運站,房間乾淨,早餐待加強(種類數量太少)”",,,距離捷運站大約3~5分鐘腳程，鄰近購物區，房間還算乾淨。,6.7,2013年11月6日星期三,2013/11/6
6377b835f9045f01eb30b036,交通便利”,,,交通便利，在市區,7.3,2013年10月30日星期三,2013/10/30
6377b835f9045f01eb30b037,普通”,,,交通方便，房間整潔，隔音尚可,6.7,2013年10月11日星期五,2013/10/11
