id,aspect,summarize
637397cd39de7355c1044dee,房間_負,工作人員的熱忱從進入飯店門口開始，到退房後都很滿意，飯店硬體設施有質感，泳池，三溫暖很棒，全體工作人員的服務，軟體，貼心令人滿意，有機會，定會再入住
637397cd39de7355c1044dee,服務_正,真的很潔淨，服務人員態度很棒，環境地點很棒
637397cd39de7355c1044dee,服務_中,貼心的配合我的需求做了調整，不愧是注重服務與旅客需求，以細緻服務為主的日式管理。
637397cd39de7355c1044dee,服務_負,工作人員的熱忱從進入飯店門口開始，到退房後都很滿意，飯店硬體設施有質感，泳池，三溫暖很棒，全體工作人員的服務，軟體，貼心令人滿意，有機會，定會再入住
637397cd39de7355c1044dee,設備_正,位於市中心，鄰近當地餐廳，靠近主要的旅遊景點，鄰近購物區，設計精美
637397cd39de7355c1044dee,設備_中,服務態度親切，房間新，設備完整。
637397cd39de7355c1044dee,設備_負,三溫暖的解說本已經翻爛了觀感超差，牆壁磁磚龜裂，服務人員沒有失禮但很散漫，淋浴間沐浴乳感覺是被稀釋過的
637397cd39de7355c1044dee,價格_正,服務很好，很喜歡它們家的，健身房，三溫暖，很棒的體驗
637397cd39de7355c1044dee,價格_中,入住日期是平日，價格比較平易近人，物超所值，房間很乾淨，但早餐跟房間比稍嫌遜色，價格可以接受的話算是一間不錯的飯店。
637397cd39de7355c1044dee,價格_負,我中山北路上住過晶華，希爾頓，南京西這邊大倉久和六福居，特愛大倉久，因為房間的設計就是好，加上我很愛上便則和浴室獨立分開外，他的浴缸泡澡是有電視的，之前住一次有覺得床頭沒插頭和，比較麻煩，但這次有新增進去，唯一可以再加強的是電視再大一點，可以加入好的音響設備，然後搖控器有點難按以外，早餐的部份我仍覺得相當普通，沒必要再加價到吃早餐，因為地理位置很好，附近有餐廳，百貨公司都夠你吃到翻掉，我個人是相當推這間飯店的休閒舒適度，床也軟，隔音比其他間好一些，但目前疫情原因還無法用三溫暖，這是他很大的賣掉，項樓泳池也不錯啦，然後咖啡機和咖啡盒都收光了
637397cd39de7355c1044def,交通_正,交通便利
637397cd39de7355c1044def,交通_中,一家子在外逛了一天后搭地鐵到西門站，悠閒的逛了西門町商圈還買了食物大包小包的回酒店，可以坐在餐廳吃，餐廳有，小時免費提供飲料。
637397cd39de7355c1044def,交通_負,看到飯店有停車場才預訂的，結果到現場說沒停車位，因為系統的問題無法更改，如果要取消可以直接線上取消，這樣的回應很傻眼
637397cd39de7355c1044def,早餐_正,提供借愛心傘，有美食旅遊地圖
637397cd39de7355c1044def,早餐_中,但這個價位早餐非常豐盛。
637397cd39de7355c1044def,早餐_負,缺點是，隔音不好，洗澡水壓不足，非常小，對於洗頭的人來說，非常不便，房間看起來整體還算新，但是房務打掃不夠確實，我們房間的瓶裝水，有，瓶是已經被喝過開過了，感覺很不衛生，位置很好，離逛街的地方很近，但是出入口人員來來去去有些複雜，但是整體來說，還算不錯
637397cd39de7355c1044def,房間_正,的，叫，態度親切友善
637397cd39de7355c1044def,房間_中,位於出入複雜的老商業大樓中，有許多禁示吸毒的告示牌，有的房間有煙味和霉味，除非對環境不要求，不然不建議啦。
637397cd39de7355c1044def,房間_負,房間燈光昏暗，溼氣很重，睡了一晚，隔天一整天喉嚨會很不舒服，地毯跟牆壁一大片發霉物體，床頭位置有著奇怪的白色纖維，怎麼擦都擦不掉，蓮蓬頭的水，冷水太小，熱水太多，無法調整成舒適的水溫沖澡，感覺皮都快被燙開了，飯店走道悶熱，沒有開空調，許多空房，感覺已經荒廢多日，門半開著，且無打掃過的跡象，感覺飯店業者已經無心經營，若是單純只是想找個地方，窩一晚，這個飯店與價格，算是划算，這應該也算優點吧。
637397cd39de7355c1044def,服務_正,唯一感覺不錯的是服務人員態度
637397cd39de7355c1044def,服務_中,服務好，房間乾淨，地點佳，價格合理。
637397cd39de7355c1044def,服務_負,房間不大，熱水不熱，訂的是六福館，卻被安排住高絲旅，感覺很差
637397cd39de7355c1044def,設備_正,地理位置離捷運及公車站近，交通方便
637397cd39de7355c1044def,設備_中,設備有點老舊但價格便宜。
637397cd39de7355c1044def,設備_負,便利，但房間剛好安排在排水管處，因此只有人房間再用水，就會有抽水馬達的聲音，以及低樓層有一些遊樂場出入人員有點複雜，其餘
637397cd39de7355c1044def,價格_正,的，叫，態度親切友善
637397cd39de7355c1044def,價格_中,價錢變動高，便宜的時候就一定會入住，地點便利，又有免費早餐。
637397cd39de7355c1044def,價格_負,缺點是，隔音不好，洗澡水壓不足，非常小，對於洗頭的人來說，非常不便，房間看起來整體還算新，但是房務打掃不夠確實，我們房間的瓶裝水，有，瓶是已經被喝過開過了，感覺很不衛生，位置很好，離逛街的地方很近，但是出入口人員來來去去有些複雜，但是整體來說，還算不錯
637397cd39de7355c1044df0,交通_正,附近有百貨公司，小吃或美食餐廳可依照自己愛好，選擇性多
637397cd39de7355c1044df0,交通_中,停車場位子太少，來飯店晚的得停到有合作但只有停車優惠的舊大亞百貨停車場。
637397cd39de7355c1044df0,交通_負,住宿資訊和實際不符，下午，分入住時飯店車位已滿，停到合作停車場需再付，元，入住和退房都要排很久的隊，明顯櫃台人員不足，早餐也普通，同樣的價位早知就去住別家了，不值得
637397cd39de7355c1044df0,早餐_正,大廳櫃檯服務人員態度很好，但餐廳服務員有待加強
637397cd39de7355c1044df0,早餐_中,不貴，地理位置很好，附近有地下街，百貨公司，書店，很好買，附近各種吃喝的餐廳店也多，飯店早餐東西選擇多，寬敞又有，唯獨。
637397cd39de7355c1044df0,早餐_負,雖然說是五星級的飯店，但卻覺得沒有到五星的水準，設備太老舊，木製的洗水臺掉漆也掉木屑，放肥皂的臺子歪歪的一副快掉的樣子，牆面還有沉積很久的黴菌垢，這些明明就是可以先處理的，還有早餐時櫃檯寫要人帶位，卻在櫃檯等了將近，分鐘，服務態度是不錯沒錯，但這種水準給五星級我覺得真的是名不符實，總體經驗差，除了位子好沒其他能比的
637397cd39de7355c1044df0,房間_正,房間布置簡單舒適，地點便利
637397cd39de7355c1044df0,房間_中,飯店員工服務很好，房間也乾淨舒適，出門遇到房務，有告知續住不用再整理，但房務仍說那就幫你們清一下垃垃，不用怕痳煩啦，回房時連床單都鋪的乾乾淨淨了，好員工一個。
637397cd39de7355c1044df0,房間_負,經過我打電話到櫃檯抗議，服務員才道歉，折騰了將近，小時才換房間給我，還屢屢道歉，我訂的房間是有浴缸的，連續三次我入住此飯店都給我沒有浴缸的房間，經過我打電話後他們才幫我換房，感覺上有點被騙
637397cd39de7355c1044df0,服務_正,清潔明亮，服務佳，附近餐飲方便
637397cd39de7355c1044df0,服務_中,飯店員工服務很好，房間也乾淨舒適，出門遇到房務，有告知續住不用再整理，但房務仍說那就幫你們清一下垃垃，不用怕痳煩啦，回房時連床單都鋪的乾乾淨淨了，好員工一個。
637397cd39de7355c1044df0,服務_負,地鐵就在飯店地下，樓，就是為了這一點方便我才住這家飯店，因為房間不比其他飯店便宜，同時必須訂，房才是新裝潢的，其餘都是舊房，員工服務態度不是很好
637397cd39de7355c1044df0,設備_正,大廳櫃檯服務人員態度很好，但餐廳服務員有待加強
637397cd39de7355c1044df0,設備_中,位置就在台北車站對面，有地下街連接捷運，下雨也不怕，價格合理，房間整潔，服務員很有禮貌
637397cd39de7355c1044df0,設備_負,房間整體設施還可以，吹風機還真的是網路大家說的古董，火車站，出口沒電梯，只有樓梯，對於有大件行李的，真的很不方便
637397cd39de7355c1044df0,價格_正,地點方便，台北車站正前方，價格便宜，值高
637397cd39de7355c1044df0,價格_中,位置就在台北車站對面，有地下街連接捷運，下雨也不怕，價格合理，房間整潔，服務員很有禮貌。
637397cd39de7355c1044df0,價格_負,一樓裝潢的很漂亮，樓上房間看得出來有整理過但品質就比較差，浴室壁面應該是直接附貼一塊塑膠壁板，洗手台，浴缸接縫處的矽利康嚴重發霉，整個浴室散發著微微尿騷味
637397cd39de7355c1044df1,交通_正,距離捷運西門站，北門站近，用走的去迪化街，寧夏夜市商圈也不會太遠，分鐘，有單人房選擇很棒，空間很有安全感，也很乾淨，附近採買吃喝都很方便
637397cd39de7355c1044df1,交通_中,北門站週邊新建立的火車紀念館，文藝彙集的中興堂，紅樓東區的同志酒吧集都是可一再造訪的地點，特別是紅樓後方有凌晨兩三點後才營業的虱目魚粥，建議前往。
637397cd39de7355c1044df1,交通_負,距離捷運過遠，裝潢風格採工業風雨挑高天花板，內部明亮整潔，維護較佳，房間大小較為適中稍顯可惜，整體值得推薦
637397cd39de7355c1044df1,早餐_正,五分鐘路程，便利商店，餐廳，健身房，電影院都有，吃喝玩樂都方便
637397cd39de7355c1044df1,早餐_中,早餐還是隔壁打狗罷火鍋吃到飽，第一次早餐吃火鍋超酷。
637397cd39de7355c1044df1,早餐_負,原本預定三人房，因為一些因素升等為四人房，內部構造跟空間呈現感跟照片一樣，缺點，隔音真的不是太好，洗手台狹隘，水花容易噴濺到旁邊的備品推車，需要多費點心，才能找到房號，房間電視機上盒，需要靠近一點才能打得開，優點，地理位置便利，房間內裝潢很有特色，很多公共空間座位，自助入住，退房，人員還是會在旁邊協助，不過當下辦理入住，我輸入了訂單號碼跟手機號碼都沒反應，最後是輸入了英文名，可是明明寫這三個都可以啊
637397cd39de7355c1044df1,房間_正,五分鐘路程，便利商店，餐廳，健身房，電影院都有，吃喝玩樂都方便
637397cd39de7355c1044df1,房間_中,雖然房間有點小，芳香劑味道過重，除此之外房間很乾淨也很舒服，因為住很邊間所以隔音很好。
637397cd39de7355c1044df1,房間_負,已經是第二次入住，這兩次入住的心得很很滿意，第一次入住時間很短，很晚進房很早退房，這一次因為颱風的關係在房內的時間多了不少，也因為剛好遇到媽媽開刀，所以跟飯店預約了無障礙的房間讓媽媽便於盥洗，真的很不錯媽媽也非常滿意，房間整潔，電視又很多節目可以選擇，就算颱風不出門也絲毫不覺得無趣，雖然剛開始使用洗臉盆，水塞出了點問題但是維修人員很快地就處理完成，還有第二天房務人員進房打掃更換物品態度也是很親切還有認真，還有地點更是極佳，入住期間遇到颱風，但是用餐完全沒有問題更不用擔心，以飯店為中心走路五分鐘內選擇多多，看了很多評價說到關於噪音問題隔音效果不佳，我們到是沒有碰到也或許是疫情關係或是颱風入住的人不多，這我不清楚，但是我們完全沒有聽到認何噪音，空調也很好溫度舒適，毛巾乾的也很快，總之，是一次很愉快的入住經驗，之後還會再選擇入住，提供訂房的人參考。
637397cd39de7355c1044df1,服務_正,地點好，離電影街近，好停車，重點是內部裝潢非常美，工業風格，非常乾淨，設施一應俱全，服務人員也專業親切
637397cd39de7355c1044df1,服務_中,女員工的態度沒有特別好，男的都還好一點，但地點和房型，只是房內都略顯黑暗和潮濕。
637397cd39de7355c1044df1,服務_負,房間味道不佳，整體空間與隔音都不大好，網路服務不直覺且房內使用一般電信服務的訊號也不佳，地段臨近西門吵雜的夜總會旁，整體差強人意，除了延遲退房不須加價之外優點不多
637397cd39de7355c1044df1,設備_正,五分鐘路程，便利商店，餐廳，健身房，電影院都有，吃喝玩樂都方便
637397cd39de7355c1044df1,設備_中,房型照片和實際環境一樣，整潔舒適，溫暖工業風感。
637397cd39de7355c1044df1,設備_負,單人房內空間沒很大，但浴廁空間挺大，工業風格設計，可能房間位置的關係，手機收訊很差，但房間，訊號不錯，在房裡不適合電話聯絡，只適合通訊軟體，床很好睡，隔音也還可以
637397cd39de7355c1044df1,價格_正,非常乾淨，舒適，性價比超高，就是地點位於西門町深處，腳程有點遠，但很值得
637397cd39de7355c1044df1,價格_中,離西門町步行約，分鐘，價格千元有找，早餐很特別是火鍋，可以評估需不需要加價購買早餐。
637397cd39de7355c1044df1,價格_負,但是沒想到房間安排在地下室，且非常多房間但電梯只有一台，還有早餐的部分是我主動詢問櫃台才有告知，萬萬沒想到早餐竟然是吃火鍋，這點比較不能接受，我是愛吃火鍋的，但覺得時間非常怪
637397cd39de7355c1044df2,交通_正,商旅附近很熱鬧有許多餐廳還有百貨公司，離捷運站很近，轉運非常方便
637397cd39de7355c1044df2,交通_中,太靠近交誼廳的房間略顯吵雜，但環境設施與地段佳，交通方便
637397cd39de7355c1044df2,交通_負,沒有附設停車場，也沒有館外停車場，給其他的停車收費資訊也跟實際上不一
637397cd39de7355c1044df2,早餐_正,距離捷運站及東區商圈近，交通非常便利，周遭又有很多美食餐廳可以選擇，是東區住宿的好選擇
637397cd39de7355c1044df2,早餐_中,離捷運站約，分鐘的步程，位處東區地帶，吃喝逛不用愁，房間比想像中的大，插頭很多這點很喜歡，公共空間有自助咖啡，沒訂早餐只喝咖啡也挺好的，反正東區餐廳多去外面吃就好了，服務人員態度親切，晚上出去還貼心遞暖暖包，離忠孝復興捷運站近，剛好可轉文湖線，去小巨蛋也很方便，要說缺點就是隔音不好，被別間退房的聲音吵醒了。
637397cd39de7355c1044df2,早餐_負,房間裡有盥洗用品，毛巾，衣架，保險箱，冰箱，電視還有電話，每天還有飯店人員打掃房間且更換備品，很像縮小版的一般飯店房間，早餐有中西式可以選擇且可選擇自取或送到房間，外面公共空間有提供茶包可以泡，共用浴室使用的沐浴乳，洗髮精是歐舒丹的，吹風機還是
637397cd39de7355c1044df2,房間_正,距離捷運站及東區商圈近，交通非常便利，周遭又有很多美食餐廳可以選擇，是東區住宿的好選擇
637397cd39de7355c1044df2,房間_中,乾淨，地點方便，可惜房間不如照片大，床很小，房間也很擠。
637397cd39de7355c1044df2,房間_負,第二次入住需共用衛浴的單人房，先前已知房間開門時氣壓關係引起的聲音稍有影響，而本次部分設施使用時覺得尚待改善，如，房間內的空調設備，有時無法使用房內的遙控器順利操作，必須請櫃檯人員協助開啟設定調控溫度，住宿樓層的烘衣設備貼上故障的字條無法使用，必須至另一樓層共用，盥洗空間的水量很小，可能是因為高樓層的關係水壓較弱，或許可以更換加壓馬達改善，限女性區域的淋浴間排水設備較弱，雖有更衣空間的乾濕分離設計，但一度清晨使用時積水達淋浴間門檻高度，不得不中途更換淋浴間使用，可能是因為毛髮堵住排水孔，如能增加清潔的頻率可望改善這的問題。
637397cd39de7355c1044df2,服務_正,很棒的旅館，位在交通便利的東區，住宿價格卻很平實，房間潔淨，管理專業，備品很優，房間外的交誼廳有舒適的桌椅，烹飪級的飲水，咖啡，點心，系統很新的電腦設施
637397cd39de7355c1044df2,服務_中,服務人員非常親切，整體來說，值很高，以後有住宿需求會再次考慮入住。
637397cd39de7355c1044df2,服務_負,本次入住為需共用衛浴的單人房，雖然不是最便宜的住宿選擇，但館內設施完善，還附有小型健身房，未聽見鄰房作息或電視聲隔音還不錯，唯房間開門時氣壓關係引起的聲音較為困擾
637397cd39de7355c1044df2,設備_正,在東區，裡面很乾淨，設備很新，有簡單的點心和咖啡區，還不錯
637397cd39de7355c1044df2,設備_中,服務人員非常親切，整體來說，值很高，以後有住宿需求會再次考慮入住
637397cd39de7355c1044df2,設備_負,第二次入住需共用衛浴的單人房，先前已知房間開門時氣壓關係引起的聲音稍有影響，而本次部分設施使用時覺得尚待改善，如，房間內的空調設備，有時無法使用房內的遙控器順利操作，必須請櫃檯人員協助開啟設定調控溫度，住宿樓層的烘衣設備貼上故障的字條無法使用，必須至另一樓層共用，盥洗空間的水量很小，可能是因為高樓層的關係水壓較弱，或許可以更換加壓馬達改善，限女性區域的淋浴間排水設備較弱，雖有更衣空間的乾濕分離設計，但一度清晨使用時積水達淋浴間門檻高度，不得不中途更換淋浴間使用，可能是因為毛髮堵住排水孔，如能增加清潔的頻率可望改善這的問題
637397cd39de7355c1044df2,價格_正,很棒的旅館，位在交通便利的東區，住宿價格卻很平實，房間潔淨，管理專業，備品很優，房間外的交誼廳有舒適的桌椅，烹飪級的飲水，咖啡，點心，系統很新的電腦設施
637397cd39de7355c1044df2,價格_中,整體環境地理位置，和價格都在水準之上。
637397cd39de7355c1044df2,價格_負,之前沒訂到房間到板橋其他同類型的旅宿，隔間的厚實都差很多，所以後來出差還是選擇這一間，整體的住宿體驗非常舒適，之後依舊會選擇入住怡品
637397cd39de7355c1044df3,交通_正,交通方便，附近購物便利，旁邊就有超商，雖不好停車，性價比還是很高
637397cd39de7355c1044df3,交通_中,鄰近台北車站附近的新光三越地段，附近吃喝買的種類多，想逛其他地區坐捷運，公車尚算方便。
637397cd39de7355c1044df3,交通_負,一般般，沒有特別之處，如果開車樓下有整天停車收費，天，小時最高收費，元，樓下條車場乾淨
637397cd39de7355c1044df3,早餐_正,客房很整潔，清潔人員很棒
637397cd39de7355c1044df3,早餐_中,很喜歡館內裝潢，小時飲料無限供應很棒，下次期待再次入住，感謝服務人員的照顧。
637397cd39de7355c1044df3,早餐_負,主要是因為距離北車很近，到捷運站或是北車走路慢慢走大概，分內會到，這間還蠻明顯的，因為他算在內部，而他門口有巨大的招牌在提醒人們他在哪，一到門口就看到他們真的是老字號，感覺各種舊，電梯很舊，設備也有年紀感，那還好，至少沒飄著一股霉味，本次入住是時尚雙人房，在八樓，無窗，一個狹長型的住宿地點，服務人員接待十分普通，就是填寫與給證件換門卡，也沒跟你說飯店內有什麼設備能用，有飲水機還是自己發現，然後八樓的壞了住了三天都沒修好，問了櫃檯才知道門口還有一台飲水機，內部設備也感覺到沒什麼，兩瓶水與兩個綠茶包，總電源插卡開關下令人疑惑的房間定價，冷氣也算正常運作，房內也沒啥霉味，還有一個很難控的電視，但價格真的不貴，所以還，飯店隔音並不是很好，走在走廊上可以聽到有人在激戰，啪啪作響，但可惜的是只持續，分鐘，只能說那男的要加油啊
637397cd39de7355c1044df3,房間_正,地理位置很好，交通非常方便，要走去搭捷運搭公車都非常方便，周圍生活機能很好
637397cd39de7355c1044df3,房間_中,房間很乾淨，廁所蓮蓬頭水量很大很不錯，房間大小適中，櫃檯親切。
637397cd39de7355c1044df3,房間_負,主要是因為距離北車很近，到捷運站或是北車走路慢慢走大概，分內會到，這間還蠻明顯的，因為他算在內部，而他門口有巨大的招牌在提醒人們他在哪，一到門口就看到他們真的是老字號，感覺各種舊，電梯很舊，設備也有年紀感，那還好，至少沒飄著一股霉味，本次入住是時尚雙人房，在八樓，無窗，一個狹長型的住宿地點，服務人員接待十分普通，就是填寫與給證件換門卡，也沒跟你說飯店內有什麼設備能用，有飲水機還是自己發現，然後八樓的壞了住了三天都沒修好，問了櫃檯才知道門口還有一台飲水機，內部設備也感覺到沒什麼，兩瓶水與兩個綠茶包，總電源插卡開關下令人疑惑的房間定價，冷氣也算正常運作，房內也沒啥霉味，還有一個很難控的電視，但價格真的不貴，所以還，飯店隔音並不是很好，走在走廊上可以聽到有人在激戰，啪啪作響，但可惜的是只持續，分鐘，只能說那男的要加油啊。
637397cd39de7355c1044df3,服務_正,客房很整潔，清潔人員很棒
637397cd39de7355c1044df3,服務_中,很喜歡館內裝潢，小時飲料無限供應很棒，下次期待再次入住，感謝服務人員的照顧。
637397cd39de7355c1044df3,服務_負,訂三人房，入住時門卡給雙人房型，打電話給櫃檯小姐冷冷回說訂的是雙人房就是只有一張雙人床，只好到櫃檯提供訂房資料重新查最後說搞錯名字升等給四人房，入住不到十分鐘又火警警報聲響起，屋況老舊，
637397cd39de7355c1044df3,設備_正,地理位置佳，生活機能高，出入捷運，公車，台鐵，高鐵都十分方便
637397cd39de7355c1044df3,設備_中,位置優越價格便宜，其餘餐廳健身房等設施不開放略為可惜。
637397cd39de7355c1044df3,設備_負,主要是因為距離北車很近，到捷運站或是北車走路慢慢走大概，分內會到，這間還蠻明顯的，因為他算在內部，而他門口有巨大的招牌在提醒人們他在哪，一到門口就看到他們真的是老字號，感覺各種舊，電梯很舊，設備也有年紀感，那還好，至少沒飄著一股霉味，本次入住是時尚雙人房，在八樓，無窗，一個狹長型的住宿地點，服務人員接待十分普通，就是填寫與給證件換門卡，也沒跟你說飯店內有什麼設備能用，有飲水機還是自己發現，然後八樓的壞了住了三天都沒修好，問了櫃檯才知道門口還有一台飲水機，內部設備也感覺到沒什麼，兩瓶水與兩個綠茶包，總電源插卡開關下令人疑惑的房間定價，冷氣也算正常運作，房內也沒啥霉味，還有一個很難控的電視，但價格真的不貴，所以還，飯店隔音並不是很好，走在走廊上可以聽到有人在激戰，啪啪作響，但可惜的是只持續，分鐘，只能說那男的要加油啊
637397cd39de7355c1044df3,價格_正,交通方便，附近購物便利，旁邊就有超商，雖不好停車，性價比還是很高
637397cd39de7355c1044df3,價格_中,位置優越價格便宜，其餘餐廳健身房等設施不開放略為可惜。
637397cd39de7355c1044df3,價格_負,訂了兩間房，一間沒窗，不舒服，房間也小，衛生也可，最滿意是空中花園及全天免費飲品及洗衣等設施，總體上性價比也是可以的
637397cd39de7355c1044df4,交通_正,建議使用大眾交通工具非常便利，
637397cd39de7355c1044df4,交通_中,住宿地點方便，離捷運超近，商圈也近，只是飯店本身稍舊，其餘部分還可以。
637397cd39de7355c1044df4,交通_負,要出差的話可以參考看看，沒有特約停車場，不過商旅附近有收費停車場
637397cd39de7355c1044df4,早餐_正,早餐有很多種新鮮蔬菜，飲料有咖啡，果汁，可爾必思，牛奶和熱茶，很豐盛
637397cd39de7355c1044df4,早餐_中,週邊機能很好，交通也方便，住宿環境不錯，房間也很乾淨，浴室水壓很大，熱水很熱，櫃檯服務人員態度很好，覺得不錯。
637397cd39de7355c1044df4,早餐_負,這次家庭旅遊開車前往，以地點來看近捷運，性價比算中上，但是飯店並沒有停車位提供，考量到停車費用後其實性價比只能算中等，此次訂房為豪華雙床，浴廁雖偏小但是還算乾淨可接受，但是，房間內居然有很多蚊子，第一天打死四支，第二天整晚還是被蚊子攻擊，小朋友睡不好，這點大大扣分，早餐供應只有到九點，要注意時間
637397cd39de7355c1044df4,房間_正,離捷運站出口很近，往各景點的各式交通也非常便捷
