id,aspect,summarize
637397cd39de7355c1044de9,交通_中,這間飯店的位置相當不錯，週邊生活機能也好，也相當適合外地人到此觀光旅遊，整體乾淨也大，部過若說有缺點大概是尖峰時期早餐用餐地點的座位比較少座位，可能會被編制到旁邊一起營業的火鍋店內座位區，除此之外我覺得相當不錯。
637397cd39de7355c1044de9,交通_負,深夜入住詢問何處停車，僅冷漠回覆沒有配合停車場，自行尋找後發現就在隔壁有地下停車場，但深夜視線不佳，亦無燈光標示，工作一天甚是疲憊，一時未察，繞了一大圈尋找回來才看到，唉，服務業是不容易，但提醒一聲，隔壁可以自費停車，讓旅客不必再費心找車位亦不難吧
637397cd39de7355c1044de9,早餐_正,捷運西門站，房間乾淨清潔，方便在西門町購物吃飯，服務人員亦很親切
637397cd39de7355c1044de9,早餐_中,這間飯店的位置相當不錯，週邊生活機能也好，也相當適合外地人到此觀光旅遊，整體乾淨也大，部過若說有缺點大概是尖峰時期早餐用餐地點的座位比較少座位，可能會被編制到旁邊一起營業的火鍋店內座位區，除此之外我覺得相當不錯。
637397cd39de7355c1044de9,早餐_負,硬體方面，飯店大廳裝潢不比一般飯店差，設有公共飲水機很加分，不像一般飯店會有房間服務，我住兩晚，第一晚整理房間時房務人員幫我少備了棉花棒，但晚上時房務人員已下班因此只能自己去櫃檯拿，這點對我而言很麻煩，捷運站出來就是飯店，十分方便，服務方面，櫃台人力較少，入住時很多人在申請國旅補助，服務人員也非常有耐心地向旅客解釋詳細解釋來龍去脈，另一方面，我自己去辦理入住時，一旁的服務人員也會前來協助我，我覺得服務很棒，值得讚許
637397cd39de7355c1044de9,房間_正,環境優美，乾淨舒適
637397cd39de7355c1044de9,房間_中,地點超讚的，捷運站，號出口錢櫃旁就到了，西門町就在附近，超近的，要逛街很方便，酒店裡服務人員態度親切，房間也很乾淨，下次去台北會想再住這裡。
637397cd39de7355c1044de9,房間_負,這次的房間不知道為什麼被安排到兩張大床，看起來是家庭房，和原本預定的不同，因為在入住時是採取自助，螢幕顯示房間還沒打掃完，和現場人員反應後，到了房間才發現是四人房，我們猜是因為房間還沒清潔完這個原因才給我們四人房，而不是原本的雙人房，這原本是好事，但是房間的灰塵多，電視的顏色不知道是老舊還是壞掉，人都黑黑的，床旁邊的沙發陷下去，沒人敢坐，我覺得原本自己預定的雙人房可能還比較好，上次住的就是雙人房，整體都很棒，反倒覺得不要升級大房可能比較好，不然這種品質真的會讓人不敢再去。
637397cd39de7355c1044de9,服務_正,捷運西門站，房間乾淨清潔，方便在西門町購物吃飯，服務人員亦很親切
637397cd39de7355c1044de9,服務_中,酒店有代收網購，而且買到要冷藏的手信，也有冰櫃幫你收藏，因為夜機回家，冷凍食物要冷藏起來，原來酒店也有代客冷凍服務，很貼心呢，房間各設備都很新很乾淨，要保持質素哦。
637397cd39de7355c1044de9,服務_負,住宿期中一晚飯店因電力檢查所有電梯停開，飯店指示不足，後備照明亦不夠，詢問下才有職員開後樓梯往樓上房間，而且本人要親自要求才有職員陪同，當到達房間樓層時才發覺該樓層的後樓梯進生門都會關上，要聯絡另一名職員開啟，此事完全反映該飯店職員應變能力不足，要多加培訓
637397cd39de7355c1044de9,設備_正,位置很好，在捷運西門站出口旁，自助，機器很新穎，裝潢很現代化，性價比很高的旅館
637397cd39de7355c1044de9,設備_中,飯店位置極佳，服務人員的態度也非常好，房間大小適中偏小但設施很，唯綜合型大樓樓層與其他營業場所共用較缺乏隱私不太好。
637397cd39de7355c1044de9,設備_負,位置很好，房內設備齊全，沙發和檯燈氣氛很棒，但隔音較差，易聽到門外與隔壁房間聲音，淋浴間並未密閉，洗完澡後洗手臺處，地板濕掉不太舒服
637397cd39de7355c1044de9,價格_正,位置，清潔都非常好，性價比非常好，唯獨未完成餐廳提供早餐及其他餐飲，希望下次入住時可以完成
637397cd39de7355c1044de9,價格_中,價格，地點都非常好，房間雖然不大但五臟俱全，早餐是自助式的，不算非常豪華但很豐盛一定能選到喜歡的食物。
637397cd39de7355c1044de9,價格_負,變成，的四人房，上面找同一天同一家飯店，人房也才，也有，份早餐，我如果取消訂單就不能退費，所以我打電話問飯店，他們要我去找，客服，我打到，客服去了，她願意幫我取消原本的，升級補差價到四人房，但是要問飯店意見，最後飯店還是跟，客服說跟我得到一樣的回覆，就是要我們補
637397cd39de7355c1044dea,交通_正,鄰近捷運中山站，號出口，從北車來可走地下街，出口，位置很方便，且靠近商圈，容易覓食及交通
637397cd39de7355c1044dea,交通_中,房間也是蠻乾淨的，早上睡過頭隔壁也有早餐店飲料店對面還有，北車也在附近，值真的很高。
637397cd39de7355c1044dea,交通_負,這次住六人一室，會受到其他房客的聲音干擾，睡不好，其餘設施地點都很佳
637397cd39de7355c1044dea,早餐_正,值超高的青年旅館，小管家個個都好親切，房間，盥洗室，交誼廳環境乾淨，舒適，文藝展覽區，入住旅人整個都文青起來，簡易早餐一早溫暖旅人的胃
637397cd39de7355c1044dea,早餐_中,缺點是熱水真的很爛，斷斷續續地，水壓和溫度很不穩，這幾天台北剛好變天感受更加明顯，希望能盡快處理。
637397cd39de7355c1044dea,早餐_負,缺點是房間較多蚊子，入住一晚打了，隻，不過有貼心的在房間附上電蚊香供使用，睡覺時並沒有被蚊子吵或被咬
637397cd39de7355c1044dea,房間_正,交通方便，離北車，中山捷運站都超近，斜對面就是當代美術館，附近美食多多，環境整潔舒適，住客也都很自律，以上班族，年輕人較多，再加上設計打理的很美麗，採光良好，大推
637397cd39de7355c1044dea,房間_中,這次住的是六人房上下舖房型，旅館位置交通方便也很熱鬧，令人印象深刻的是共用衛浴非常乾淨，一點發霉和水垢都沒有，對於背包客房型共用衛浴而言，能打掃得這麼乾淨表示服務人員真的有很認真維持整潔。
637397cd39de7355c1044dea,房間_負,然後衛生狀況比上次感覺差一點，拖鞋的櫃子打開有臭味，裡面有其他房間丟的垃圾，用過的卸妝棉，我想是因為房間沒有垃圾箱，所以有人把垃圾亂丟，清潔人員也沒有檢查清楚，這點有點扣分
637397cd39de7355c1044dea,服務_正,地點很棒北車走出來不到幾分鐘就到了，員工也很親切細心，便宜的價格還附早餐，整個很棒，而且走路到赤峰街那也不遠
637397cd39de7355c1044dea,服務_中,員工服務親切，房間很乾淨，整體都很棒，可惜早餐，點才開始，有點晚
637397cd39de7355c1044dea,服務_負,雖然二樓辦公區因為書店進駐，對於住宿旅客的開放時間有所調整，但是各有各的風味與優點，推薦
637397cd39de7355c1044dea,設備_正,環境很乾淨，設備蠻新的
637397cd39de7355c1044dea,設備_中,這次住的是六人房上下舖房型，旅館位置交通方便也很熱鬧，令人印象深刻的是共用衛浴非常乾淨，一點發霉和水垢都沒有，對於背包客房型共用衛浴而言，能打掃得這麼乾淨表示服務人員真的有很認真維持整潔。
637397cd39de7355c1044dea,設備_負,環境很乾淨，設備很齊全，防疫期間電梯及共用衛浴也會準備酒精，整體是舒適的住宿體驗
637397cd39de7355c1044dea,價格_正,地點很棒北車走出來不到幾分鐘就到了，員工也很親切細心，便宜的價格還附早餐，整個很棒，而且走路到赤峰街那也不遠
637397cd39de7355c1044dea,價格_中,設施也很不錯，但熱水供應有一點點不穩定，只是一點點。
637397cd39de7355c1044dea,價格_負,缺點是房間較多蚊子，入住一晚打了，隻，不過有貼心的在房間附上電蚊香供使用，睡覺時並沒有被蚊子吵或被咬
637397cd39de7355c1044deb,交通_正,飯店樓下有星巴克，周邊生活機能很好，美食免煩惱，交通方便捷運站附近，房間乾淨舒適，台北住宿首選推薦
637397cd39de7355c1044deb,交通_中,優點，有停車場，設施很新，早餐提供星巴克，有機會下回還會入住。
637397cd39de7355c1044deb,交通_負,缺，停車場電梯只到大廳有點不方便，優，地點優越，床好睡，隔音佳，二樓還有販賣機半夜可解解饞
637397cd39de7355c1044deb,早餐_正,大廳很美，進來還有淡淡的香氛，很有高級感
637397cd39de7355c1044deb,早餐_中,飯店裡有星巴克，如果入住遇到假日，星巴克只為飯店旅客而開，很貼心，有一些特定商品有興趣可以購買，這間星巴克是有提供酒精飲品，雖然酒單沒有很豐富，但是想喝喝星巴克的含酒精飲品可以來嘗鮮，當然如果要喝星巴克的調酒酒吧，最近的推薦是日本東京。
637397cd39de7355c1044deb,早餐_負,入住時間，交通，鄰近善導寺站，有行李或者不想走樓梯的，請使用用，號出口，服務，積極親切，溫和並有效率，住房，配備有咖啡機方便使用，並有各種枕頭供房客使用，整體算是一應俱全，不過可惜沒有沐浴鹽，大廳一旁還有星巴克，房客享有九折優惠，感覺，住房品優渥，隔音佳，洗澡水溫，水速均有很好的表現，房內潔淨度良好，床鋪個人覺得偏軟，採光極佳，隱私稍微可惜，浴室廁所分離，周邊，之名阜杭豆漿，飲料，速食店，便利商店，公車，捷運站等均有，這次的住房經驗整體很棒，也感謝飯店對於我們紀念日的重視，期待下次入住
637397cd39de7355c1044deb,房間_正,飯店樓下有星巴克，周邊生活機能很好，美食免煩惱，交通方便捷運站附近，房間乾淨舒適，台北住宿首選推薦
637397cd39de7355c1044deb,房間_中,飯店是連鎖集團的品牌，同等的服務但是價格優惠非常多，房間設計非常好，健身房，小時開放，在善導寺，交通也非常方便，但是早餐是星巴克，不喜歡吃麵包當早餐的人就有點可惜了，非常推薦各位來這邊。
637397cd39de7355c1044deb,房間_負,入住時間，交通，鄰近善導寺站，有行李或者不想走樓梯的，請使用用，號出口，服務，積極親切，溫和並有效率，住房，配備有咖啡機方便使用，並有各種枕頭供房客使用，整體算是一應俱全，不過可惜沒有沐浴鹽，大廳一旁還有星巴克，房客享有九折優惠，感覺，住房品優渥，隔音佳，洗澡水溫，水速均有很好的表現，房內潔淨度良好，床鋪個人覺得偏軟，採光極佳，隱私稍微可惜，浴室廁所分離，周邊，之名阜杭豆漿，飲料，速食店，便利商店，公車，捷運站等均有，這次的住房經驗整體很棒，也感謝飯店對於我們紀念日的重視，期待下次入住
637397cd39de7355c1044deb,服務_正,住宿可在星巴克咖啡享，折優惠，早上時段僅房客可入星巴克，清幽享受咖啡是不錯
637397cd39de7355c1044deb,服務_中,台北時代寓所，除了擁有極佳便利的區位，精緻品質的裝修氛圍，服務人員也都秉持著親切貼心的服務。
637397cd39de7355c1044deb,服務_負,房務人員的態度比櫃檯，接待人員好，千萬不能用髒床單，會被莫名酌收不合理清潔費，每個人都需要提供證件，入住相當耗時，使用，訂房，訂房人也是相符合入住人，即使給了編號，也同步用訊息跟飯店聯繫，照樣無法入住，退房還得站在櫃檯等候，檢查房間是否有被我們毀損，跟犯人沒有兩樣，貴飯店的服務一流在電話一頭的還會反泊，別的飯店可以，不代表我們可以，沒有敬語的五星級飯店，本人平均一個月住，次以上飯店，在貴飯店發生的事情，都是頭一遭經驗，人生第一次想給飯店評價
637397cd39de7355c1044deb,設備_正,全新裝潢，設備絕佳，一定要訂有早餐方案，給星巴克的點數很有誠意
637397cd39de7355c1044deb,設備_中,房間內的視聽環境完整，隔音佳，螢幕投影便利，窗簾遮光效果好，讓我們享受了一夜的電影和音樂。
637397cd39de7355c1044deb,設備_負,第一次入住，非常喜歡這間飯店，硬體設備都很先進也很人性化，電視很大，躺在沙發看也都覺得螢幕很大，鏡面投影對於不太看台灣電視節目的人來真的是太貼心了，有機會一定會再入住
637397cd39de7355c1044deb,價格_正,住宿可在星巴克咖啡享，折優惠，早上時段僅房客可入星巴克，清幽享受咖啡是不錯
637397cd39de7355c1044deb,價格_中,飯店是連鎖集團的品牌，同等的服務但是價格優惠非常多，房間設計非常好，健身房，小時開放，在善導寺，交通也非常方便，但是早餐是星巴克，不喜歡吃麵包當早餐的人就有點可惜了，非常推薦各位來這邊。
637397cd39de7355c1044deb,價格_負,客房清潔稍嫌不足，地板踩到，片不知道是塑膠片還是指甲的東西，床頭裝飾面板有明顯手痕跟污漬，地點確實很優，飯店也很新，以市區飯店來說房間大小已算不錯
637397cd39de7355c1044dec,交通_正,乾淨，交通便捷，早餐優，服務佳
637397cd39de7355c1044dec,交通_中,整潔度，員工服務態度都很好，裡面還有高科技小美機，只要躺著喊口令就可開燈，開關窗戶。
637397cd39de7355c1044dec,交通_負,以該飯店的收費對照其所在位置，設備，餐點，服務，真的沒什麼好嫌的，硬要說缺點的話大概是離兩個捷運站都要走幾百公尺的距離，另外飯店沒有提供一個公共區域可以讓大家休閒有點可惜吧
637397cd39de7355c1044dec,早餐_正,訂來給南部上來的長輩入住，員工親切，升等房型，有自由取用的零食小舖，很有特色，早餐不錯
637397cd39de7355c1044dec,早餐_中,性價比極高房間也很好很乾淨而且視野也很舒服看出去很漂亮然後食物也很好吃員工的服務很好會讓人覺得花錢很值得的飯店會想著要再去住一次的好飯店。
637397cd39de7355c1044dec,早餐_負,這次住六樓，在房間內一直聽到同樓層的房客開關門的聲音跟聊天的聲音，不只關門聲音很清楚，有時候在床頭也會感受到震動，整個晚上沒有辦法好好在房間休息，還會被嚇到，房間內的小冰箱發霉，也不太能冷藏，晚上打電話問飯店員工卻被告知房間內的冰箱是化學冰箱，本來就不太能冷藏，他們辦公室提供的冰箱也被其他房客冰滿了，沒有辦法解決我們的問題，最生氣的早上要下樓用早餐，當初會選擇花園酒店而不是其他飯店也是看了其他人的評價覺得早餐選擇多，提供的也不錯，結果八點半下去發現門口一堆人在排隊，沒辦法進入用餐，飯店員工沒有辦法給我們要等待的時間，只讓我們選擇要不要用餐盒外帶方式，後來有工作人員表示現場有兩位的可以先入坐，我們上前表示我們是兩位的，穿西裝外套的女生卻告訴我們要從頭排隊
637397cd39de7355c1044dec,房間_正,廁所雖小，但真的很舒適又亮堂乾淨，泡澡池很日式
637397cd39de7355c1044dec,房間_中,性價比極高房間也很好很乾淨而且視野也很舒服看出去很漂亮然後食物也很好吃員工的服務很好會讓人覺得花錢很值得的飯店會想著要再去住一次的好飯店。
637397cd39de7355c1044dec,房間_負,這次住六樓，在房間內一直聽到同樓層的房客開關門的聲音跟聊天的聲音，不只關門聲音很清楚，有時候在床頭也會感受到震動，整個晚上沒有辦法好好在房間休息，還會被嚇到，房間內的小冰箱發霉，也不太能冷藏，晚上打電話問飯店員工卻被告知房間內的冰箱是化學冰箱，本來就不太能冷藏，他們辦公室提供的冰箱也被其他房客冰滿了，沒有辦法解決我們的問題，最生氣的早上要下樓用早餐，當初會選擇花園酒店而不是其他飯店也是看了其他人的評價覺得早餐選擇多，提供的也不錯，結果八點半下去發現門口一堆人在排隊，沒辦法進入用餐，飯店員工沒有辦法給我們要等待的時間，只讓我們選擇要不要用餐盒外帶方式，後來有工作人員表示現場有兩位的可以先入坐，我們上前表示我們是兩位的，穿西裝外套的女生卻告訴我們要從頭排隊
637397cd39de7355c1044dec,服務_正,乾淨舒適，工作人員親切，房務人員打掃很乾淨
637397cd39de7355c1044dec,服務_中,很合宜的價格，而房間寬敞舒適，明亮乾淨，廁所高級燈光好，服務人員很有熱忱，還提供西門，龍山寺捷運站接駁服務。
637397cd39de7355c1044dec,服務_負,點多，時還需稍等確認房間，已入住時過不久，位服務人員，有可能有敲門我們沒聽到，直接開門當時好險有門擋，我開門出去他們就問我們是續住人員，我答剛入住後，當下，位服務人員態度稍不及格急忙就走掉，讓我有點傻眼
637397cd39de7355c1044dec,設備_正,柑仔店很有趣，房間設備很舒適，高樓層看風景很舒服
637397cd39de7355c1044dec,設備_中,很合宜的價格，而房間寬敞舒適，明亮乾淨，廁所高級燈光好，服務人員很有熱忱，還提供西門，龍山寺捷運站接駁服務。
637397cd39de7355c1044dec,設備_負,電梯會固定停在一樓減少旅客等待時間，和之前入住相比，不論走道還是房內，多了很多插畫，也展示了艋舺當地的歷史元素，房間慢慢轉型為智慧化，提供語音機器人等設施，但走道的地毯還是比較有老飯店的感覺，這次入住雖然升等，人房，但是房內的地板與桌上都有黏黏的液體，可能沒有清潔乾淨，其餘不論隔音，舒適度都很不錯
637397cd39de7355c1044dec,價格_正,乾靜，舒適，價格便宜吸引我
637397cd39de7355c1044dec,價格_中,很合宜的價格，而房間寬敞舒適，明亮乾淨，廁所高級燈光好，服務人員很有熱忱，還提供西門，龍山寺捷運站接駁服務。
637397cd39de7355c1044dec,價格_負,床好睡也蠻大的，衛浴設備有浴缸，價錢合理，下次有機會再入住
637397cd39de7355c1044ded,交通_正,位置相當優越，距離沙灘步行很近，服務人員態度很好
637397cd39de7355c1044ded,交通_中,
637397cd39de7355c1044ded,交通_負,離海灘很近
637397cd39de7355c1044ded,早餐_正,設備與環境都不錯，也有自己的泳池供孩童玩樂，要去沙灘也很近，美中不足的在餐廳餐點部分或許多用點心會更好
637397cd39de7355c1044ded,早餐_中,整體上來說都不錯，飯店後方就是海水浴場，可玩海水也有室內泳池兩種感受一次滿足。
637397cd39de7355c1044ded,早餐_負,房間很貼心的提供了海灘拖鞋，連小朋友的都設想到了，防曬乳也準備好了，房內電影很新很多樣，而且都不用另外付錢，看得很過癮，床墊和空調十分舒適，游泳池水溫很剛好，每一樓層都有茶水間提供冰塊和熱水，還有飲料販賣機，飲料價格也都很平實，兒童遊戲區域玩具比較少但是空間很舒適，所有服務人員都會很誠意的跟客人打招戶，讓人賓至如歸，這次還沒機會泡湯，一定還要再回來
637397cd39de7355c1044ded,房間_正,地理位置很棒，有通往海邊的橋，沙灘有沙雕，海灘也算乾淨，比萬里的乾淨多了
637397cd39de7355c1044ded,房間_中,設施相當新且整潔，房間空間也很大，人員服務態度良好，但兒童遊戲設施略顯陽春，美中不足。
637397cd39de7355c1044ded,房間_負,房間很貼心的提供了海灘拖鞋，連小朋友的都設想到了，防曬乳也準備好了，房內電影很新很多樣，而且都不用另外付錢，看得很過癮，床墊和空調十分舒適，游泳池水溫很剛好，每一樓層都有茶水間提供冰塊和熱水，還有飲料販賣機，飲料價格也都很平實，兒童遊戲區域玩具比較少但是空間很舒適，所有服務人員都會很誠意的跟客人打招戶，讓人賓至如歸，這次還沒機會泡湯，一定還要再回來
637397cd39de7355c1044ded,服務_正,位置相當優越，距離沙灘步行很近，服務人員態度很好
637397cd39de7355c1044ded,服務_中,員工服務很好，住宿當晚，家中長輩突然過敏發作，飯店員工馬上安排車輛送去急診站看診，很感謝飯店的處理。
637397cd39de7355c1044ded,服務_負,房間很貼心的提供了海灘拖鞋，連小朋友的都設想到了，防曬乳也準備好了，房內電影很新很多樣，而且都不用另外付錢，看得很過癮，床墊和空調十分舒適，游泳池水溫很剛好，每一樓層都有茶水間提供冰塊和熱水，還有飲料販賣機，飲料價格也都很平實，兒童遊戲區域玩具比較少但是空間很舒適，所有服務人員都會很誠意的跟客人打招戶，讓人賓至如歸，這次還沒機會泡湯，一定還要再回來
637397cd39de7355c1044ded,設備_正,設備與環境都不錯，也有自己的泳池供孩童玩樂，要去沙灘也很近，美中不足的在餐廳餐點部分或許多用點心會更好
637397cd39de7355c1044ded,設備_中,設施相當新且整潔，房間空間也很大，人員服務態度良好，但兒童遊戲設施略顯陽春，美中不足。
637397cd39de7355c1044ded,設備_負,房間很貼心的提供了海灘拖鞋，連小朋友的都設想到了，防曬乳也準備好了，房內電影很新很多樣，而且都不用另外付錢，看得很過癮，床墊和空調十分舒適，游泳池水溫很剛好，每一樓層都有茶水間提供冰塊和熱水，還有飲料販賣機，飲料價格也都很平實，兒童遊戲區域玩具比較少但是空間很舒適，所有服務人員都會很誠意的跟客人打招戶，讓人賓至如歸，這次還沒機會泡湯，一定還要再回來
637397cd39de7355c1044ded,價格_正,不管是房間，餐廳空間都很舒適
637397cd39de7355c1044ded,價格_中,早餐也好吃，只可惜沒有現做蛋捲，個人喜好
637397cd39de7355c1044ded,價格_負,房間很貼心的提供了海灘拖鞋，連小朋友的都設想到了，防曬乳也準備好了，房內電影很新很多樣，而且都不用另外付錢，看得很過癮，床墊和空調十分舒適，游泳池水溫很剛好，每一樓層都有茶水間提供冰塊和熱水，還有飲料販賣機，飲料價格也都很平實，兒童遊戲區域玩具比較少但是空間很舒適，所有服務人員都會很誠意的跟客人打招戶，讓人賓至如歸，這次還沒機會泡湯，一定還要再回來
637397cd39de7355c1044dee,交通_正,位置方便，緊鄰捷運中山站，中山站商圈，交通，飲食都相當便利
637397cd39de7355c1044dee,交通_中,鄰近捷運站，交通便利，停車位晚上就滿了。
637397cd39de7355c1044dee,交通_負,唯一比較需要提的是，一開始要辦理入住時將車子開入停車場時，有看到立牌顯示車位已滿請到其他停車場找位子，但當下又要注意後方來車，又要看立牌上地圖，真的很不容易，且停車場的服務人員也沒有主動上前說明引導，這部分建議可以再改進
637397cd39de7355c1044dee,早餐_正,早餐的選擇也算很豐富，雖然入住剛好是週末假日，但排隊人潮也很快疏通，而飯店位置絕佳，位於中山北路和南京東路交叉口，距離捷運站走路三分鐘，旁邊有新光三越百貨公司，誠品南西店，數不清的餐廳，另外赤峰街商圈也有許多迷人小店
637397cd39de7355c1044dee,早餐_中,入住日期是平日，價格比較平易近人，物超所值，房間很乾淨，但早餐跟房間比稍嫌遜色，價格可以接受的話算是一間不錯的飯店。
637397cd39de7355c1044dee,早餐_負,這次是為了慶生入住大倉久和，但並沒有特別和飯店提及此事，在辦理入住時櫃臺人員應該是發現了，很貼心的偷偷幫忙升等到超豪華客房，讓我一打開房間就有了極大的驚喜，由於房間實在太舒服，讓我當晚早早就回飯店捨不得離開，這次遇到的每位飯店員工都有很棒的服務態度，中午退房時剛好遇到房務，他們大老遠看到客人就熱情問候
637397cd39de7355c1044dee,房間_正,不愧為日式系統管理的飯店，適合商務需求的朋友，簡約寧靜的環境，附近又處於商圈，鬧中取靜
637397cd39de7355c1044dee,房間_中,入住日期是平日，價格比較平易近人，物超所值，房間很乾淨，但早餐跟房間比稍嫌遜色，價格可以接受的話算是一間不錯的飯店。
