id,aspect,summarize
637397cd39de7355c1044de5,交通_正,遇到的服務人員都非常親切，本來擔心停車場難停車，發現有代客泊車服務，非常專業
637397cd39de7355c1044de5,交通_中,停車場很難開，路很窄要特別小心，而且沒有交管。
637397cd39de7355c1044de5,交通_負,飯店應積極協助住客，附近可停位置，而不是只說一句沒位置，就把問題留給客人
637397cd39de7355c1044de5,早餐_正,遇到的服務人員都非常親切，本來擔心停車場難停車，發現有代客泊車服務，非常專業
637397cd39de7355c1044de5,早餐_中,地理位置很好很方便，床很大很舒適，水壓很夠也很熱，空調也很好，只是車位較少但可以泊車，早餐內容的選擇性稍嫌少了一點，退房時間電梯要等比較久。
637397cd39de7355c1044de5,早餐_負,帶一歲的寶寶入住，房間內該有的設施都有，嬰兒床，澡盆，椅凳，消毒鍋，空氣清淨，體重機，鞋子烘乾機等，且房間內有一個平台，可以擺放消毒鍋，奶粉及奶瓶等，空間規劃舒適，飯店地點也很方便，走路就有很多餐廳及百貨公司，飯店人員服務態度友善，值得推薦
637397cd39de7355c1044de5,房間_正,遇到的服務人員都非常親切，本來擔心停車場難停車，發現有代客泊車服務，非常專業
637397cd39de7355c1044de5,房間_中,地理位置很好很方便，床很大很舒適，水壓很夠也很熱，空調也很好，只是車位較少但可以泊車，早餐內容的選擇性稍嫌少了一點，退房時間電梯要等比較久。
637397cd39de7355c1044de5,房間_負,只是若電視畫質品質可以更好會再加分，因為使用，但很多台都收訊不好，本身只有三十個頻道左右可以看，有二十個頻道不是沒畫面就是聲音影像不同步，客服說因爲週遭大樓太多擋住了，但，這不就是企業要解決問題的時候嗎，而不是只推給設備問題，雖然去住宿電視不是最重要的，但有時只想擔在飯店享受時真的是需要電視的
637397cd39de7355c1044de5,服務_正,遇到的服務人員都非常親切，本來擔心停車場難停車，發現有代客泊車服務，非常專業
637397cd39de7355c1044de5,服務_中,浴室很乾淨但老舊，電視台少，沒電影可看，但服務人員超級客氣，服務超級好。
637397cd39de7355c1044de5,服務_負,帶一歲的寶寶入住，房間內該有的設施都有，嬰兒床，澡盆，椅凳，消毒鍋，空氣清淨，體重機，鞋子烘乾機等，且房間內有一個平台，可以擺放消毒鍋，奶粉及奶瓶等，空間規劃舒適，飯店地點也很方便，走路就有很多餐廳及百貨公司，飯店人員服務態度友善，值得推薦
637397cd39de7355c1044de5,設備_正,位置方便，價格合理，物超所值而且很高級
637397cd39de7355c1044de5,設備_中,設施方面，馬桶與浴室分開雖然是一個很棒的構想，但廁間的洗手檯無法置放肥皂或洗手乳，相當可惜。
637397cd39de7355c1044de5,設備_負,整體房間是整潔安靜的，但瓶裝水只有兩瓶，每層樓也沒有設置飲水機必須至地下一樓裝水，非常不方便，熱水瓶沒有相對的插座，必須擠壓桌面使用空間拔掉燈座或清淨機的插頭才能使用，非常不便
637397cd39de7355c1044de5,價格_正,位置方便，價格合理，物超所值而且很高級
637397cd39de7355c1044de5,價格_中,訂的是不含早餐的價格，覺得很划算
637397cd39de7355c1044de5,價格_負,帶一歲的寶寶入住，房間內該有的設施都有，嬰兒床，澡盆，椅凳，消毒鍋，空氣清淨，體重機，鞋子烘乾機等，且房間內有一個平台，可以擺放消毒鍋，奶粉及奶瓶等，空間規劃舒適，飯店地點也很方便，走路就有很多餐廳及百貨公司，飯店人員服務態度友善，值得推薦
637397cd39de7355c1044de6,交通_正,附近有便利商店也有捷運站，吃東西也很方便，步行約，分鐘可以到南機場夜市
637397cd39de7355c1044de6,交通_中,位於萬華火車站的上方，捷運板南線龍山寺站旁，距離龍山寺及艋舺夜市很近，前方有星巴克萬華林宅店，有專用免費停車塔，無論交通，停車，逛街和餐飲等都非常方便。
637397cd39de7355c1044de6,交通_負,當日入住，房，高樓層景觀沒話說，此外房價折扣後不到，的價格，雖然不含早餐，房間不算大，但隔音極佳走廊聲音傳不進房間超加分，房內設施該有的也都有，免治馬桶，浴缸，放大化妝鏡，連身鏡，浴室還有掛衣繩可以曬衣服，床和枕頭也很好睡，真的不錯，比較可惜的是停車場並不在飯店地下室，是對側的機械式立體停車場，且停車費須至，樓櫃台消磁，這讓我覺得困擾的是電梯可以直接搭到，樓空橋去開車，但因為消磁要去，樓櫃台，導致我完全不想再回去，樓走空橋，這棟現看能不能在，樓設計一個可以消磁的機制，或者在轉交停車幣時就先做設定可以免去此麻煩，不然真的很可惜
637397cd39de7355c1044de6,早餐_正,連續入住，晚，住宿感受都很好，飯店與萬華車站共構，交通很方便，離龍山寺捷運站也只有步行約，分鐘的時間，周邊美食很多，入住部分，程序都很迅速，大廳寬敞乾淨，坐在沙發也很舒適，飯店人員態度都很友善，出入門都有人員協助開門，離開房間遇見清潔人員，他們也會親切的打招呼，房間清潔也都一絲不苟，很棒
637397cd39de7355c1044de6,早餐_中,飯店的地點非常的好，不管是車站還是捷運站都非常的近，周邊商圈購物也很方便，走路，分鐘還有夜市可以逛，飯店人員服務態度很好也很貼心，提供的自助式早餐總類多也很好吃，下次一定會在選擇凱達。
637397cd39de7355c1044de6,早餐_負,價格不貴的星級飯店，位置也很好，但服務人員很難找，優點，星級飯店來說，價位並不高，房間設施及裝潢都比同價位的旅店還要好，入住兩次房間都有大玻璃可以直接遠看龍山寺方向，缺點，服務人員難找，出發前想要以電話詢問小朋友的加價付費，晚上，點左右電話進總機後就無人接聽，至少等，分鐘，至少打了三天，每天至少打三次以上，都懷疑這間飯店還在不在，淋浴的空間明顯比較小，且淋浴間的門縫隙明顯很大感覺淋浴方向不對會往外噴，且不能鎖
637397cd39de7355c1044de6,房間_正,連續入住，晚，住宿感受都很好，飯店與萬華車站共構，交通很方便，離龍山寺捷運站也只有步行約，分鐘的時間，周邊美食很多，入住部分，程序都很迅速，大廳寬敞乾淨，坐在沙發也很舒適，飯店人員態度都很友善，出入門都有人員協助開門，離開房間遇見清潔人員，他們也會親切的打招呼，房間清潔也都一絲不苟，很棒
637397cd39de7355c1044de6,房間_中,飯店很新房間很棒，但需要保留較長時間辦理入住手續，服務人員很努力消化人潮請多點耐心，房間的配置很新穎很舒服，浴室廁所是分開的很棒。
637397cd39de7355c1044de6,房間_負,只有面淡水河房間景觀好這個優點的飯店，只有面淡水河房間景觀好這個優點的飯店，這次去入住，一共住了兩天，分別是，與，兩天去都遇到了幾個問題，第一是電梯不夠，間房的等級，只有，台電梯，還非高速電梯，這電梯還要混載一般用餐與會議的旅客，去停車塔除了繞一圈，也是只能搭電梯從，樓走空橋，尤其泳池與健身房在，樓，而電梯是奔違停高樓層與低樓層的，因此一半的電梯不停八樓，所以所有去健身房或與池的高樓層旅客，都得先搭電梯到五樓以下，再換低樓層電梯到八樓，這也導致低樓層電梯有超過兩倍房客的使用量，加上拉行李的，有的穿著濕濕的泳衣圍毛巾的，甚至還有拿泳圈的，這也導致電梯的效率更加惡化，第二是人力不夠，這次入住沒用旅遊補助而是透過訂房網站，可是，的入住要花一個多小時，的入住也要排隊花超過，分鐘快，分鐘，這效率很差，前台也少，這兩次入住也花了大量時間在早餐的取餐上面，因為餐廳的人力嚴重不足，導致玻璃杯是空的，餐檯一堆是空的，連麵包都是空的，牛奶，豆漿，汽水也是空的，連稀飯都是空的，只有咖啡機的咖啡渣是滿的，然後當然也沒有人力去清理，只能說我的天呀，但是這是牌價一人，元的早餐喔，第三是退房時，機車停車卡不能比照汽車直接消磁，還得去停車塔人工消磁，去停車塔還得出示訂房的訂單才可以，第四是房間的清潔不好，入住的，房，施工的電線在浴室屋頂與洗手台下是外露的，此外牆壁上爬滿了白色的蚜蟲，最後用衛生紙幫它們殺死的幾時上百隻的蚜蟲，這也與房間浴室設計缺乏通風排氣設備有關，所以浴室一弄濕就是師道第二天早上，這與習慣的日系飯店都有強制換氣廁所不同，第五是房間的隔音不好，隔壁與門外常會聽到有人喧嘩，甚至連一般門外對對話偷聽得到，例如道早安，詢問是否是退房，是否還會回來，是否可以進行打掃，第六是健身房泳池沒人顧，員工自己在健身房裡聊天吹冷氣運動，而非在門外看房卡量體溫那些，第七是水量不是很足，所以浴缸要放水得要十多分鐘，夠你沐浴完身體，可先去上個大號再回來泡澡，第八是房間只有兩瓶便宜的波爾水與，咖啡包，其他甚麼，軟性飲料等宣傳的都沒有，所以請花時間搭電梯去旁邊的，或是萬華車站裡的全家購買，第九是開門關門，房內電源就會切掉，這對於房內舒適度是有很大的差異，上面九點就是主要的缺點，優點部分，其一是有高樓層優勢，對淡水河那面還算不錯的視野，不過這優點凸顯在大稻埕花火節這一天上，其二是床的舒適度不錯，不過羽絨枕就比較差，沒多久就坍了，棉被較不透氣，因此空調開，度會流汗，其三是其中一邊的床頭提供有，充電孔，可以方便你幫手機充電，不過有點接觸不良，此外也不具備大電流高速充電的機能，其四是有平面停車場供機車停車，雖然主要目的是供月票員工停車的，但是是少數有機車停車場的飯店。
637397cd39de7355c1044de6,服務_正,便宜又舒服又可以泡澡也乾淨隔音很好服務態度超棒
637397cd39de7355c1044de6,服務_中,價格便宜，房間設備，整潔，人員服務都很好，比某些價格更高的飯店好多了。
637397cd39de7355c1044de6,服務_負,飯店動線不明確，辦理入住櫃檯手續時還一度搞不清楚我們有訂房，房內也沒有衛生紙，服務員回答說房內和廁所的衛生紙是共用的，沒提供抽取式衛生紙，房內電視也還不能看，既然設施不完全又為什麼要開放入住，且也沒有在任何地方事先告知，浴室內也沒有任何放置衣物或毛巾的地方，飯店人員素質參差不齊有的態度良好
637397cd39de7355c1044de6,設備_正,附近有便利商店也有捷運站，吃東西也很方便，步行約，分鐘可以到南機場夜市
637397cd39de7355c1044de6,設備_中,價格便宜，房間設備，整潔，人員服務都很好，比某些價格更高的飯店好多了。
637397cd39de7355c1044de6,設備_負,隔音狀況良好的雙人房，較其他飯店喜歡隔成，平方米的窄小房間稍大，有個小沙發區收看電視或作為簡易辦公區間，公務行程頗合適，但缺點乾濕分離的浴廁，卻把洗臉盆併梳妝鏡放在房間，且鏡前沒有座椅，這就有令人費解，尤其在空間稱不上大的前提下
637397cd39de7355c1044de6,價格_正,價格便宜，服務良好，清潔人員也很有禮貌，適合單人或短期的商務旅行
637397cd39de7355c1044de6,價格_中,這價格可以住到凱撒系列酒店十分划算，房間不大但空間安排得宜也不擁擠，設備裝潢都很新，飯店還有游泳池跟健身房可以使用，不含早餐的價格很便宜。
637397cd39de7355c1044de6,價格_負,價格不貴的星級飯店，位置也很好，但服務人員很難找，優點，星級飯店來說，價位並不高，房間設施及裝潢都比同價位的旅店還要好，入住兩次房間都有大玻璃可以直接遠看龍山寺方向，缺點，服務人員難找，出發前想要以電話詢問小朋友的加價付費，晚上，點左右電話進總機後就無人接聽，至少等，分鐘，至少打了三天，每天至少打三次以上，都懷疑這間飯店還在不在，淋浴的空間明顯比較小，且淋浴間的門縫隙明顯很大感覺淋浴方向不對會往外噴，且不能鎖
637397cd39de7355c1044de7,交通_正,交通便利，乾淨舒適
637397cd39de7355c1044de7,交通_中,捷運出口近，飯店樓下有好吃的麵包店，看小巨蛋演唱會不用人擠人坐捷運回家
637397cd39de7355c1044de7,交通_負,南京復興站出站即到，去小巨蛋步行也是，分鐘可到的範圍內，不用看完演唱會還要跟人擠捷運，附近生活機能良好有缺少什麼生活用品要買也不是問題，餐廳吃的也多距離遼寧夜市也是走一下就到了，這次還有使用傳真功能，張，塊比小七便宜直接在櫃台就能完成，早餐豐盛會有專門的人負責帶位，停車的話要從慶城街進來導航飯店地址會找不到入口錯開用餐時間的話會比較容易有車位，退房時將停車單給櫃台蓋章即可免費停車
637397cd39de7355c1044de7,早餐_正,住宿舒適，交通也相當方便，還有相當好吃的港式飲茶餐廳
637397cd39de7355c1044de7,早餐_中,交通位置佳，緊臨捷運站，開車前來也有地下停車場可以停，但停車場入口位置比較不好找，服務人員整體素質良好，櫃檯人員訓練有素，應答得體，防疫措施也很好，出入都有量體溫，清潔人員也很親切，做事細心不馬虎，客房乾淨且安靜，備品齊全充足，早餐有，的美式早餐或是，的自助早餐，簡單豐盛又美味，這次清明連假台北住宿兄弟大飯店，價格合宜，值很高。
637397cd39de7355c1044de7,早餐_負,第一次入住兄弟大飯店，在飯店大門前的迎賓員工就讓人感受到滿滿的親切感，在報到入住時，櫃檯人員專業的說明相關服務與設施讓人一清瞭然，客房雖不大，但蘊含著日式低調又不失奢華的風格，飯店利用房間的每一個角落，擺上對應的用品，衣櫃的室內拖，小吧檯的熱水壺，礦泉水，咖啡杯組，咖啡茶包，其附有職人濾掛式的咖啡，來一杯如同現煮的咖啡讓人覺得心意滿滿，浴室的洗手台前有明亮的照明與大片玻璃，不說還以為來到專業的化妝台，也附有各式的盥洗用具，相當貼心，唯獨很可惜浴缸與浴室並無乾濕分離，要注意腳滑跌倒，小扣分，隔一天的早晨提供的餐食雖說不是太多樣，但基本中西式的餐點都有提供，西式如法式金黃吐司，附蜜糖，炒蛋，肉腸，火腿，沙拉，中式如粥類，味噌湯，白飯，豬腳，咖哩雞，配粥小菜，果汁飲料等等，住一晚相當滿足滿足，若日後還有機會一定再訪
637397cd39de7355c1044de7,房間_正,參加小巨蛋演唱會很方便，走路就能抵達，房間很舒適乾淨，資深員工服務很親切
637397cd39de7355c1044de7,房間_中,老牌飯店，位置極佳，停車吃飯時間要排很久，最好避開吃飯時間，旁邊有慶城街一號很多吃的可以選擇，房間乾淨，性價比極高，非常推薦。
637397cd39de7355c1044de7,房間_負,第一次入住兄弟大飯店，在飯店大門前的迎賓員工就讓人感受到滿滿的親切感，在報到入住時，櫃檯人員專業的說明相關服務與設施讓人一清瞭然，客房雖不大，但蘊含著日式低調又不失奢華的風格，飯店利用房間的每一個角落，擺上對應的用品，衣櫃的室內拖，小吧檯的熱水壺，礦泉水，咖啡杯組，咖啡茶包，其附有職人濾掛式的咖啡，來一杯如同現煮的咖啡讓人覺得心意滿滿，浴室的洗手台前有明亮的照明與大片玻璃，不說還以為來到專業的化妝台，也附有各式的盥洗用具，相當貼心，唯獨很可惜浴缸與浴室並無乾濕分離，要注意腳滑跌倒，小扣分，隔一天的早晨提供的餐食雖說不是太多樣，但基本中西式的餐點都有提供，西式如法式金黃吐司，附蜜糖，炒蛋，肉腸，火腿，沙拉，中式如粥類，味噌湯，白飯，豬腳，咖哩雞，配粥小菜，果汁飲料等等，住一晚相當滿足滿足，若日後還有機會一定再訪
637397cd39de7355c1044de7,服務_正,餐廳很棒，地點絕佳，服務周到，交通便利，但是隔音很差
637397cd39de7355c1044de7,服務_中,櫃台人員很主動服務，有時候就是這種快速的服務，親切的態度，讓人感覺很好。
637397cd39de7355c1044de7,服務_負,一直以來對住宿選擇都次新飯店為首選，這次為了看音樂劇，在沒有太多時間考慮下選了老牌飯店，兄弟飯店，沒想到兄弟飯店不僅交通方便距離小巨蛋步行五分鐘左右，而且飯店內有多樣的餐廳可以選擇，最重要的是房間全部翻新裝潢過，沒有老舊飯店的粉塵或異味問題，設計簡潔大方，床鋪非常好睡，房間乾淨備品齊全，服務人員態度親切，全家人都十分滿意，非常推薦
637397cd39de7355c1044de7,設備_正,內部房間重新整修，所以房內設施都蠻新的，門口就捷運站，所以交通非常方便，距離小巨蛋也是步行就可以到的，週邊有餐廳，便利商店，美妝店，便利性高
637397cd39de7355c1044de7,設備_中,飯店內的餐廳名氣都不錯，如果飯店有游泳設施更好。
637397cd39de7355c1044de7,設備_負,缺點是房間的空間，以北市星級飯店來說偏小，我住面捷運站的房間，基本只能看到捷運站的屋頂，無視野可言
637397cd39de7355c1044de7,價格_正,價格划算，早餐有兩種餐廳可以選擇，距離小巨蛋真的蠻近的，附近超商，康是美的屈臣氏，肯德基，麥當勞，都有，而且都超近，房間乾淨
637397cd39de7355c1044de7,價格_中,早餐中規中矩，晚上，過後夜宵牛肉麵驚豔，自費，飯店內多樣餐廳可選擇，交通便利旁邊就是捷運站。
637397cd39de7355c1044de7,價格_負,一直以來對住宿選擇都次新飯店為首選，這次為了看音樂劇，在沒有太多時間考慮下選了老牌飯店，兄弟飯店，沒想到兄弟飯店不僅交通方便距離小巨蛋步行五分鐘左右，而且飯店內有多樣的餐廳可以選擇，最重要的是房間全部翻新裝潢過，沒有老舊飯店的粉塵或異味問題，設計簡潔大方，床鋪非常好睡，房間乾淨備品齊全，服務人員態度親切，全家人都十分滿意，非常推薦
637397cd39de7355c1044de8,交通_正,步行，分鐘內可達公車轉運站及板橋火車站，加上現在正是新北耶誕城的活動時間，交通十分便利
637397cd39de7355c1044de8,交通_中,不喜歡開車，喜歡機車小旅行的，這裡也有機車停車，在鬧區中央，晚上看完電影走回飯店很舒服。
637397cd39de7355c1044de8,交通_負,中午，點，後還有車位，晚上吃個飯回來，點就沒車位了，沒辦法就排隊等車位，等了，分鐘，服務人員雖然有提醒說紅線不能停車，但是也沒告如何處理沒停車位的問題，甚至沒有說哪裡有停車場，丟給房客自己處理，結果果然被警察驅離，只好去外面找付費車位，跑第一家停車場有提醒無法過夜，還好有告知去哪裡可以停車，停好後停車費我想應該不少，回飯店員是否有停車補貼之類的，因為之前住馥都飯店雖然也是車位滿了，但是有給附近停車場地圖，還可以拿發票退現金，凱撒服務人員說沒有辦法，只能排隊乾等，我是有等啊，那你叫警察不要趕人阿，那就算了，後來出去買東西，看到有車子開進來直接請服務人員停飯店外圍，忽然發現自己乖乖等車位像個笨蛋
637397cd39de7355c1044de8,早餐_正,飯店在高鐵站斜對面就到，附近美食餐廳臨立，服務人員親切，環境五星級，太棒了
637397cd39de7355c1044de8,早餐_中,設施以及房間都很整潔，櫃檯服務人員態度有待加強以及停車位供不應求，清潔人員很親切有服務熱忱。
637397cd39de7355c1044de8,早餐_負,飯店從管理到設施都具有水準，入住期間唯一的困擾，就是停車場出口的民權路，交通尖峰時間常常會遇到，被準備右轉縣民大道的待轉車輛阻塞，因為要等候行人通過和綠燈秒數過短，還有另外提醒開車入住的客人注意避開晚上，點到，點，因為來飯店宴會用餐的客人車輛停放所造成的停車位不足
637397cd39de7355c1044de8,房間_正,交通便利，附近也很多餐廳，百貨，地理位置相當好
637397cd39de7355c1044de8,房間_中,入住等很久，一定要等到三點才有房間，房間寬敞，浴室很乾淨，服務人員態度很好，下雨沒法使用游泳池，可惜連三溫暖都沒有。
637397cd39de7355c1044de8,房間_負,懷疑自己住到員工房還是，房，一開始在，花了多一點點的錢，選擇了雙人床房型，而不是比較便宜的單人床房型，結果到了要辦入住時櫃檯說雙人床沒了剩單人床，不過我說我們付了比較多的錢所以礙於這個，還是弄出了一間房間出來，結果一進到房間枕頭一人一顆而已，棉被也只是對折放床上，根本沒有四星級飯店該有基本折法很草率，要睡覺時關電燈，玄關燈可能漏電還怎樣，開著燈沒事，一關燈就噠噠噠的根本沒辦法睡覺，只好打電話給櫃檯叫人來暫時把燈管的電暫時切離，真的不可能來第二次了
637397cd39de7355c1044de8,服務_正,飯店在高鐵站斜對面就到，附近美食餐廳臨立，服務人員親切，環境五星級，太棒了
637397cd39de7355c1044de8,服務_中,設施以及房間都很整潔，櫃檯服務人員態度有待加強以及停車位供不應求，清潔人員很親切有服務熱忱。
637397cd39de7355c1044de8,服務_負,房間設施和游泳池都很棒，泳池服務生有問必答很親切，只是最後退房打壞了好心情，我排隊等一般櫃台時，有女服務生過來引導房費已結清的可至快速退房，結果過去快速退房時，電腦當機，男服務生也沒評估重開機時間跟我去一般櫃台重排的時間哪個比較久就請我過去重排，事後證明我在原地等比較快，我在重排時，女服務生又過來請結清房費的過去快速退房，我好心向她說那邊電腦當機，結果她過去了解確認電腦，後，又過來引導我後面的房客過去，完全忽略我
637397cd39de7355c1044de8,設備_正,地點交通方便，附近有娛樂和餐廳都很多，住宿品質是大飯店禮儀，對待都在之上，設備裝潢也很舒適典雅，會再光顧的飯店
637397cd39de7355c1044de8,設備_中,設施以及房間都很整潔，櫃檯服務人員態度有待加強以及停車位供不應求，清潔人員很親切有服務熱忱。
637397cd39de7355c1044de8,設備_負,飯店也頂樓有游泳池，但是玻璃有點髒，可能是不容易清洗吧，看到的風景有點打折，另外下雨天泳池也不開放，但是還是很棒的享受，房間的窗簾遮陽能力也很強，外面太陽很大窗簾拉起來都覺得是陰天，當時住九樓，晚上會突然聽到機械聲，但是不是很大聲，對睡眠影響不大，手機可以直接用藍芽連電視，但是每一間的房間電視名稱都一樣，很常看到一半畫面被其他房客的手機連走，飯店內沒有飲水機，水要自己買不太方便，房間很乾淨，有泳池的飯店性價比應該是凱撒，值最高了，有機會會再去消費
637397cd39de7355c1044de8,價格_正,電動馬桶也很好用，清潔做得很足很乾淨，地點是在板橋站，號出口一出過一條馬路就能到達飯店，地點是超棒的
637397cd39de7355c1044de8,價格_中,地理位置優良，旁邊三鐵共構，交通方便，櫃台人員親切，房間還免費升等，房內整潔乾淨，真的非常推薦，有機會絕對會再次入住。
637397cd39de7355c1044de8,價格_負,飯店也頂樓有游泳池，但是玻璃有點髒，可能是不容易清洗吧，看到的風景有點打折，另外下雨天泳池也不開放，但是還是很棒的享受，房間的窗簾遮陽能力也很強，外面太陽很大窗簾拉起來都覺得是陰天，當時住九樓，晚上會突然聽到機械聲，但是不是很大聲，對睡眠影響不大，手機可以直接用藍芽連電視，但是每一間的房間電視名稱都一樣，很常看到一半畫面被其他房客的手機連走，飯店內沒有飲水機，水要自己買不太方便，房間很乾淨，有泳池的飯店性價比應該是凱撒，值最高了，有機會會再去消費
637397cd39de7355c1044de9,交通_正,離捷運西門站出口極近，地理位置方便，周邊地區繁榮，價格平易近人
